{
  "app_id": "dev.koto.samples.hello-text",
  "kind": "koto",
  "package": "sample_hello_text",
  "name": "SDK Hello Text",
  "description": "Draws hello-world text.",
  "category": "Samples",
  "runtime": "kotoruntime-bytecode",
  "source": "src/main.koto",
  "icon": "icon.kicon",
  "memory": {
    "sram_work_bytes": 16384,
    "psram_cache_bytes": 32768
  },
  "permissions": {
    "fs": "sandbox",
    "network": false
  }
}
