{
  "app_id": "dev.koto.samples.counter-loop",
  "kind": "koto",
  "package": "sample_counter_loop",
  "name": "SDK Counter Loop",
  "description": "Counts in a cooperative loop.",
  "category": "Samples",
  "runtime": "kotoruntime-bytecode",
  "source": "src/main.koto",
  "icon": "icon.kicon",
  "memory": {
    "sram_work_bytes": 16384,
    "psram_cache_bytes": 32768
  },
  "permissions": {
    "fs": "sandbox",
    "network": false
  }
}
